,Category,ProbableCause
375,pilot_issue,"The pilot's failure maintain adequate clearance snow covered terrain en route descent flat light conditions, resulted controlled flight terrain."
376,pilot_issue,The pilot's failure lower landing gear landing. Contributing accident examiner’s failure check landing gear extended.
377,pilot_issue,The pilot's loss directional control landing roll slush-covered runway.
378,pilot_issue,"The pilot's failure maintain directional control landing flat light conditions, resulted ground loop."
379,pilot_issue,"The pilot's failure arrest descent rate maneuvering low altitude, resulted impact terrain."
380,pilot_issue,The flight instructor’s student pilot’s failure ensure landing gear extended landing.
381,flight_issue,"The flight instructor's inadvertent throttle reduction idle, resulted total loss engine power subsequent impact terrain following power-off autorotation."
382,pilot_issue,"The pilot's failure remove right skid trailer tie-down attempting take off, resulted dynamic roll-over."
383,pilot_issue,"The student pilot's improper pedal cyclic input maneuvering, resulted loss helicopter control."
384,pilot_issue,The pilot's delayed decision abort takeoff airplane passed point anticipated liftoff would occur.
385,pilot_issue,The student pilot's failure maintain directional control landing snow/slush-covered portion runway flight instructor's improper decision allow student make first solo flight snow/slush-covered runway.
386,pilot_issue,The pilot's failure maintain airplane control go-around. Contributing accident pilot’s decision take perceiving rudder issue taxi operations.
387,pilot_issue,"The pilot’s inadequate preflight fuel planning, resulted loss engine power due fuel exhaustion."
388,pilot_issue,"The pilot's failure maintain adequate airspeed final approach, resulted airplane exceeding critical angle attack subsequent aerodynamic stall low altitude recover."
389,pilot_issue,"The inadvertent engine start unoccupied airplane, resulted moving forward impacting hangar electrical box."
390,pilot_issue,"The pilot’s failure complete landing checklist, resulted delayed extension landing gear, subsequent exceedance airplane's critical angle attack, resulted aerodynamic stall."
391,pilot_issue,The pilot's failure maintain clearance fence low-altitude maneuvering.
392,pilot_issue,"The pilot's improper landing flare gusting crosswind conditions, resulted airplane porpoising subsequent loss directional control, runway excursion, nose-over."
393,pilot_issue,"The pilot’s loss directional control snow-covered runway, resulted runway excursion."
394,pilot_issue,"The pilot's failure properly secure crew hatch door takeoff, resulted door’s forward hinge assembly tearing fuselage mount point."
395,pilot_issue,"The pilot's improper approach delayed decision apply corrective action, resulted runway overrun, impact berm, subsequent nose-over."
396,pilot_issue,"The inadequate inspection fuel selector valve, degraded, allowed fuel leak, resulted fuel starvation loss engine power."
397,pilot_issue,"The pilot's improper landing flare, resulted bounced landing, subsequent failure maintain directional control, resulted left main landing gear tire bursting tailwheel assembly failing."
398,pilot_issue,The pilot's failure maintain clearance approach lights instrument approach.
399,environment_issue,An encounter severe convective turbulence associated strong sheared environment associated jet stream.
400,pilot_issue,The pilot’s loss directional control subsequent nose landing gear collapse undetermined reasons.
401,pilot_issue,The pilot's failure maintain clearance snow-covered terrain maneuvering low altitude.
402,pilot_issue,"failure small UAS remote pilot give way helicopter, resulting inflight collision. Contributing incident sUAS remote pilot’s failure assess mitigate risks operations close proximity aircraft. Also contributing incident lack inclusion sUAS operations part aviation activity risk mitigation."
403,pilot_issue,"The pilot's delayed response initiate go-around night visual approach water airplane entered instrument meteorological conditions, resulted loss forward visibility subsequent impact water."
404,pilot_issue,"The student pilot's failure maintain directional control flight instructor's inadequate remediation short-field takeoff, resulted impact parked airplane."
405,pilot_issue,"The pilot's improper continuation landing landed far runway high speed, resulted loss directional control runway excursion."
406,environment_issue,An unavoidable collision garbage dumpster blown path airplane takeoff roll.
407,pilot_issue,"The fracture right main landing gear torque link bolt landing, resulted landing gear assembly rotating freely, subsequent loss directional control, landing gear collapsing."
408,pilot_issue,"The pilot's improper landing flare crosswind conditions, resulted bounced landing, subsequent failure maintain directional control, resulted ground-loop."
409,pilot_issue,"The student pilot's failure maintain directional control takeoff, resulted runway excursion subsequent nose-over."
410,pilot_issue,"The pilot's improper landing flare, resulted bounced landing, subsequent failure maintain directional control, resulted runway excursion impact sign."
411,pilot_issue,"A total loss engine power engines due fuel exhaustion, resulted landing short runway."
412,pilot_issue,"The pilot's failure apply full carburetor heat operating conditions conducive carburetor icing, resulted total loss engine power, forced landing, impact tree."
413,pilot_issue,The pilot's decision land turf runway insufficient landing performance subsequent loss control landing roll.
414,pilot_issue,"The pilot's failure maintain directional control landing crosswind conditions, resulted ground-loop."
415,pilot_issue,"The pilot's failure maintain proper descent rate, resulted hard landing, subsequent loss airplane control attempted go-around."
416,pilot_issue,"The pilot’s decision continue flight visual flight rules instrument meteorological conditions, resulted pilot’s spatial disorientation loss control. Contributing accident pilot’s likely self-induced pressure pilot’s plan continuation bias, adversely affected decision-making, Island Express Helicopters Inc.’s inadequate review oversight safety management processes."
417,environment_issue,The National Transportation Safety Board determines probable cause collision Cooperative Spirit RC Creppel tows two pilots’ insufficient radio communication meeting bend broadcasting accurate AIS information regarding tow size.
418,pilot_issue,"The pilot’s exceedance airplane’s structural limitations conducting previous aerobatic maneuvers, resulted in-flight breakup airplane."
419,pilot_issue,"The pilot's improper approach landing flare, resulted stall subsequent hard, bounced landing."
420,pilot_issue,"The pilot's exceedance airplane's critical angle attack, resulted aerodynamic stall subsequent loss control low altitude."
421,pilot_issue,The tail wheel mechanism detachment reasons could determined due lack available evidence resulted loss directional control landing.
422,pilot_issue,"The pilot receiving instruction’s loss directional control landing crosswind, resulted runway excursion left main landing gear collapsing."
423,pilot_issue,"The pilot's failure maintain directional control landing, resulted runway excursion nose-over right wheel encountered mud."
424,pilot_issue,"The pilot's failure maintain clearance fencing around landing pad landing, resulted tail rotor contacting fence."
425,pilot_issue,"The pilot's inadvertent application brakes landing roll, resulted nose-over."
426,pilot_issue,"The student pilot's failure maintain helicopter control maneuvering land, resulted impact airplane hangar."
427,pilot_issue,"The pilot's failure maintain directional control landing roll runway icy patches, resulted impact snowbank subsequent nose-over."
428,pilot_issue,"The pilot's improper landing flare gusting crosswind conditions, resulted bounced landing, subsequent failure maintain directional control, resulted runway excursion nose-over."
429,pilot_issue,"The pilot's failure maintain directional control aborted takeoff, resulted collision barricade."
430,pilot_issue,"The failure tailwheel attachment tube takeoff roll, resulted loss directional control, runway excursion, left main landing gear collapsing."
431,pilot_issue,The pilot’s failure maintain control airplane following loss engine power. The loss engine power result fuel starvation due degraded fuel tank fuel contamination.
432,pilot_issue,"The pilot receiving instruction’s misunderstanding flight instructor’s instruction pilot's instructor’s insufficient use rudder adding power operating engine, resulted airplane rolling left wing striking ground. Contributing accident flight instructor's delayed remedial action."
433,pilot_issue,"The pilot's failure properly configure airplane takeoff, resulted premature liftoff, loss control, collision terrain."
434,pilot_issue,"The pilot's failure properly configure amphibious airplane water landing, resulted flipping over."
435,environment_issue,"The National Transportation Safety Board determines probable cause collision inbound tanker Bow Fortune outbound commercial fishing vessel Pappy’s Pride captain Pappy’s Pride’s outbound course toward ship channel, created close quarters situation restricted visibility. Contributing lack communication captain Pappy’s Pride."
436,pilot_issue,"The student pilot's failure arrest airplane’s descent rate, resulted hard landing."
437,pilot_issue,The pilot's failure maintain clearance parked airplane taxi operations night.
438,environment_issue,encounter convectively induced turbulence overflying area known convective activity.
439,pilot_issue,failure deicing truck driver maintain appropriate clearance airplane.
440,pilot_issue,"The pilot's improper decision attempt off-airport departure rough terrain without inspecting takeoff area, resulted collision shallow rut takeoff nose landing gear collapsing."
441,pilot_issue,"The student pilot's failure allow adequate separation passing parked airplane, resulted ground collision."
442,pilot_issue,"The pilot receiving instruction's failure maintain airplane control landing crosswind, resulted bounced landing, flight instructor's delayed remedial action, resulted loss control go-around."
443,pilot_issue,"The pilot’s mismanagement fuel selector, resulted fuel starvation total loss engine power."
444,pilot_issue,The pilot’s impairment/incapacitation carbon monoxide poisoning due degraded muffler. Contributing accident pilot’s failure properly maintain airplane.
445,pilot_issue,"The student pilot's loss airplane control short field takeoff gusting crosswind conditions, designated pilot examiner's delayed remedial action."
446,pilot_issue,"The pilot's failure maintain control airplane intentional aerodynamic stall, resulted spin subsequent collision terrain."
447,flight_issue,A total loss engine power reasons could determined based available information.
448,pilot_issue,"The airplane hydroplaning landing wet runway, degraded braking capability resulted runway overrun onto grass mud nose landing gear collapsing. Contributing accident pilot's improper decision land airplane near runway midpoint due fog approach end runway."
449,pilot_issue,"The pilot's failure maintain adequate clearance terrain hover-taxi, resulted helicopter's skid contacting grass subsequent dynamic roll-over."
450,pilot_issue,"The pilot's poor preflight planning, failed verify proper procedure activate runway lights; inability locate airport without lighting; airplane’s subsequent low-fuel state circled looking airport, necessitated precautionary off-airport landing, nose landing gear separated."
451,pilot_issue,"The pilot's failure maintain proper descent rate landing, resulted hard landing short runway."
452,environment_issue,"The airplane’s encounter turbulence descent, resulted serious injury flight attendant."
453,pilot_issue,"The pilot’s inadequate fuel management, resulted total loss engine power due fuel starvation, pilot’s inadequate preflight inspection preflight fuel planning."
454,pilot_issue,The National Transportation Safety Board determines probable cause striking Rock Island Railroad Bridge barges INO85100 INO85226 pushed William C steering port initiated pilot inability pilot return vessel channel. Contributing casualty short amount time distance pilot correct steering error stop vessel prior striking Rock Island Railroad Bridge.
