,Category,ProbableCause
0,pilot_issue,The pilot's failure maintain directional control airplane landing.
1,pilot_issue,The pilot's loss directional control landing.
2,flight_issue,The National Transportation Safety Board determines probable cause contact towing vessel Old Glory barge Cole Peter P. Cobb Memorial Bridge protective fendering inadequate navigational assessment identify risk strong cross- currents area bridge transit.
3,pilot_issue,The pilot's failure maintain clearance taxiway sign landing.
4,pilot_issue,The pilot’s failure maintain altitude short final due encounter draft flight instructor's delayed remedial action.
5,pilot_issue,"The pilot's misjudgment airplane’s speed altitude landing approach, failure attain proper touchdown point landing, resulted runway overrun. Contributing accident access limited set flight controls, obstructed vision due seating position, pilot’s decision return relatively constrained runway following perceived anomaly airplane’s flaps."
6,pilot_issue,"The pilot’s failure maintain directional control landing roll, resulted ground-loop."
7,pilot_issue,"The pilot's improper pitch attitude landing flare, resulted hard landing. Contributing accident flight instructors delayed remedial action."
8,pilot_issue,"The pilot's decision attempt takeoff middle runway shifting wind conditions, resulted aborted takeoff runway excursion."
9,pilot_issue,"The pilot’s loss visual reference agricultural low-level flight, resulting collision power lines."
10,pilot_issue,The pilot's failure maintain airplane control water takeoff encounter wake boat.
11,pilot_issue,"The pilot's inadequate flare, resulting hard landing."
12,pilot_issue,The pilot's failure stow speed brake prior attempting takeoff.
13,pilot_issue,The pilot maintain control airplane landing.
14,pilot_issue,"The pilot's failure maintain directional control landing, resulted runway excursion impact vegetation."
15,pilot_issue,"The pilot's failure maintain directional control takeoff, resulted runway excursion subsequent impact obstacle terrain."
16,pilot_issue,"The pilot’s failure maintain proper descent rate balloon’s approach high-wind landing, resulted hard landing serious passenger injury."
17,pilot_issue,"The pilot's inability maintain altitude due loss thermal lift, resulted off-airport landing."
18,pilot_issue,"The pilot’s failure maintain airplane control maneuvering land resulted aerodynamic stall low altitude, pilot unable recover from."
19,pilot_issue,"The pilot's decision continue unstable approach resulted inadequate flare, bounced landing collision trees following delayed go around."
20,pilot_issue,None determined.
21,pilot_issue,"The pilot's selection unsuitable terrain landing, resulted loss control landing nose over."
22,pilot_issue,The pilot's decision takeoff towards known obstacles resulted impact power line.
23,pilot_issue,"The pilot's failure monitor aircraft control, resulted loss control passenger inadvertently moved control stick, pilot passenger's decision unbuckle restraints inflight."
24,pilot_issue,"The pilot's failure maintain directional control takeoff crosswind conditions, resulted ground loop."
25,pilot_issue,"The pilot’s inability regain airplane control pilot-induced spin conducted flight test, resulted collision terrain."
26,pilot_issue,"The pilot's improper recovery bounced landing failure maintain directional control, resulted runway excursion collision trees."
27,pilot_issue,"The pilot's premature application brakes landing, resulted nose-over event."
28,flight_issue,"A partial loss engine power due formation carburetor ice ground, resulted reduced climb capability impact trees initial climb."
29,pilot_issue,The student pilot's inadequate decision make premature turn onto taxiway resulted collision taxiway sign.
30,pilot_issue,The student pilot misjudged landing flare resulted loss control hard bounced landing.
31,pilot_issue,"The flight instructor maintain proper approach path landing flare landing tailwind, resulted hard landing damaged landing gear. During subsequent landing damaged landing gear, flight instructor lost directional control resulted runway excursion collision objects."
32,pilot_issue,"The pilot's failure maintain clearance trees go-around, resulted impact terrain."
33,pilot_issue,"The passenger's inadvertent application rear brakes landing, resulted nose-over."
34,pilot_issue,The pilot's failure attain/maintain directional control landing resulted ground-loop collision terrain.
35,pilot_issue,The flight instructor's failure maintain helicopter control resulted hard landing preforming practice autorotation.
36,pilot_issue,"The flight instructor’s inadequate remedial action following student pilot’s loss directional control landing, resulted runway excursion subsequent nose over."
37,pilot_issue,"The pilot’s failure maintain control airplane simulated power landing, flight instructor's delayed remedial action, resulted loss control airplane’s left wing striking ground."
38,pilot_issue,Foreign object damage sustained main rotor blades due aerial tree trimming.
39,pilot_issue,"The pilot’s improper decision place passenger baggage rear baggage compartment, resulted aft center gravity, increase directional instability, affected pilot’s ability maintain directional control, resulting ground loop landing roll."
40,pilot_issue,"The pilot's failure maintain directional control landing gusting wind conditions, resulted impact large hole nose-over."
41,pilot_issue,"The pilot's failure maintain directional control takeoff crosswind conditions, resulted runway excursion collision trees."
42,pilot_issue,"The pilot’s distraction failure maintain adequate airspeed low altitude maneuver, resulted loss aircraft control collision terrain."
43,pilot_issue,"The pilot's excessive speed landing wet grass runway, resulted runway excursion impact fence."
44,pilot_issue,The pilot’s inability arrest descent rate balloon encountered unforecasted high ground wind resulted hard landing.
45,pilot_issue,"The balloon pilot’s inability maintain proper descent rate balloon’s approach landing un-forecasted weather, resulted hard landing."
46,pilot_issue,"The balloon pilot’s inability maintain altitude un-forecasted weather, resulted hard landing."
47,pilot_issue,The pilot’s improper recovery bounced landing.
48,environment_issue,The National Transportation Safety Board determines probable cause breakaway containership CMA CGM Bianca Napoleon Avenue Container Terminal wharf ensuing equipment damage sudden onset unforecasted severe winds likely originating outflow thunderstorm-generated downburst.
49,pilot_issue,"The pilot's failure maintain directional control takeoff tailwind, resulted subsequent collapse right main landing gear."
50,pilot_issue,The pilot's misjudgment landing flare resulted bounced landing.
51,pilot_issue,"The pilot remove rudder gust lock preflight inspection, resulted forced landing collision tree."
52,pilot_issue,"The unstabilized landing approach gusty wind conditions resulted hard, bounced landing."
53,pilot_issue,"The pilot's failure maintain directional control takeoff, resulted runway excursion impact vegetation."
54,pilot_issue,"The pilot's failure attain proper landing approach speed touchdown point, resulted runway overrun."
55,pilot_issue,"The pilot's overapplication brakes landing gusting tailwind conditions, resulted nose-over."
56,pilot_issue,"The pilot’s failure retract landing gear water landing, resulted nose over. Contributing accident pilot’s failure properly use prelanding checklist."
57,pilot_issue,A loss engine power due water contamination fuel system. Contributing accident pilot’s inadequate preflight sump fuel tanks prior flight.
58,pilot_issue,The pilot’s failure maintain main rotor clearance ground obstacle landing.
59,pilot_issue,The pilot’s failure maintain clearance guy-wires low-altitude agricultural operations.
60,pilot_issue,The pilot's failure maintain clearance attempting fly power lines aerial application pass.
61,pilot_issue,"The pilot's failure ensure engine oil cap installed takeoff, resulted oil obscuring pilot’s view windshield necessitated forced landing unsuitable terrain. Contributing accident pilot’s complacency self-induced pressure complete flight."
62,pilot_issue,"The pilot's improper decision depart off-airport surface standing water, resulted loss control impact terrain."
63,pilot_issue,The pilot’s failure maintain control airplane attempted engine start.
64,pilot_issue,"The pilot's exceedance airplane's critical angle attack attempting avoid deer landing, resulting aerodynamic stall."
65,pilot_issue,The pilot's inadequate preflight performance planning decision utilize available runway high density altitude operations led inflight loss control subsequent collision terrain.
66,flight_issue,"The failure right main landing gear extend prior landing, could duplicated postaccident tests."
67,pilot_issue,"The pilot's failure maintain control airplane low-level pass, resulting airplane exceeding critical angle attack caused aerodynamic stall subsequent impact terrain. Contributing accident pilot's distraction low-level pass."
68,pilot_issue,The pilot's failure maintain adequate clearance known obstacle landing hover.
69,pilot_issue,"The pilot's failure adequately monitor fuel quantity flight, resulted fuel exhaustion total loss engine power."
70,pilot_issue,"The pilot's improper pitch attitude soft-field landing roll, resulted tail striking runway."
71,pilot_issue,The pilot maintain control airplane landing subsequent go around.
72,pilot_issue,The pilot's loss directional control landing tailwheel airplane slight left quartering tailwind. Contributing accident flight instructor's delayed remedial action.
73,pilot_issue,The pilot’s application left brake landing resulting runway excursion.
74,pilot_issue,The pilot's failure attain/maintain directional control landing resulted ground loop impact terrain.
75,pilot_issue,The pilot maintain clearance wires aerial application flight.
76,pilot_issue,"The pilot's application brakes taxi, resulted nose over."
77,pilot_issue,The pilot’s inadequate compensation wind gust landing.
78,pilot_issue,A hard landing subsequent loss control.
79,flight_issue,The loss engine power due fuel starvation
80,pilot_issue,"The pilot's improper landing flare, resulted bounced landing subsequent main landing gear collapse."
81,pilot_issue,An inadequate flare resulted bounced landing pilot's failure maintain directional control.
82,pilot_issue,"The pilot's failure maintain directional control forced landing quartering tailwind, following partial loss engine power due carburetor icing."
83,pilot_issue,The pilots maintain directional control airplane landing.
84,pilot_issue,The pilot's failure maintain airplane control landing resulting nose over.
85,pilot_issue,"The pilot's failure see avoid boat's mast, resulted main rotor blade strike. Contributing accident pilot's inadequate preflight planning boat's mast measured."
86,pilot_issue,"The pilot's failure retract amphibious airplane’s landing gear prior water landing, resulted nose over."
87,pilot_issue,The pilot's failure maintain directional control landing resulting ground loop.
88,pilot_issue,The pilot's failure maintain directional landing wet grass runway.
89,pilot_issue,A loss directional control takeoff undetermined reasons.
90,environment_issue,Excessive wear left brake liners reduced brake effectiveness resulting runway excursion.
91,pilot_issue,"The flight instructor student pilot properly transfer airplane control ground rollout, resulted airplane exiting runway impacting ditch."
92,pilot_issue,"The pilot's failure attain proper approach speed, resulted overrun wet grass runway."
93,pilot_issue,"The pilot's failure maintain proper approach speed descent path runway, resulted excessive speed touchdown insufficient runway remaining safely bring airplane stop end runway. Contributing accident airplane's diminished braking due dew-covered grass runway condition."
94,pilot_issue,"The pilot's loss control landing, resulted ground loop left main landing gear collapse."
95,pilot_issue,"The pilot's failure maintain airplane control landing gusting wind conditions, flight instructor's delayed remedial action, resulted left wing striking runway."
96,pilot_issue,"The pilot's failure maintain directional control crosswind landing, resulted nose over."
97,pilot_issue,"The mechanic’s incorrect rigging aileron control cables, resulted reversal aileron control inputs applied pilot takeoff. Also causal mechanic’s inadequate post-maintenance inspection pilot's inadequate preflight inspection takeoff check, failed detect misrigging."
98,pilot_issue,The student pilot's failure maintain airplane control airplane drifted runway centerline subsequently collided taxiway sign go-around.
99,pilot_issue,The pilot's inability arrest descent rate maintain altitude encountering downdraft maneuvering low altitude near mountainous terrain resulted hard landing.
100,environment_issue,"The encounter downdrafts attempted takeoff, resulted decreased airplane's climb performance subsequent impact terrain."
101,pilot_issue,"The pilot's decision land excessive approach airspeed, resulted airplane landing long, application additional braking action stop subsequent nose over."
102,pilot_issue,"The student pilot's improper landing flare improper recovery bounced landing, resulted hard landing."
103,pilot_issue,"The pilot's failure maintain airplane control takeoff high density altitude conditions, resulted collision terrain. Contributing accident pilot's failure accomplish performance calculations atmospheric conditions."
104,pilot_issue,The flight instructor’s failure maintain control airplane following unannounced transfer flight control takeoff.
105,pilot_issue,The pilot’s inadequate inflight planning resulted loss engine power due fuel exhaustion.
106,pilot_issue,"The pilot's failure maintain directional control soft field takeoff dirt airstrip, resulted impact vehicle."
107,pilot_issue,The PA-32 pilot's failure see avoid airplane.
108,pilot_issue,The crew leader's decision throw chainsaw bar moving arc main rotor blade.
109,pilot_issue,The pilot’s failure maintain directional control landing resulting runway excursion subsequent ground loop. Contributing outcome flight instructor’s inadequate remedial actions.
110,environment_issue,encounter convective turbulence.
111,pilot_issue,"The student pilot's improper landing flare, resulted hard landing nosegear nosegear collapse."
112,pilot_issue,"The solo student pilot's improper landing flare, resulted bounced landing subsequent nose over."
113,pilot_issue,The pilot's failure maintain airplane control go-around resulted airplane exceeding critical angle attack aerodynamically stalling resulted collision ground.
114,pilot_issue,"The pilot's delayed decision abort takeoff roll, resulted runway overrun airplane nose over."
115,pilot_issue,"The pilot's distraction takeoff, resulted collision terrain."
116,pilot_issue,"The pilot's failure maintain directional control airplane landing gusting wind conditions, resulted runway excursion collision fence."
117,pilot_issue,The commercial pilot's exceedance airplane's critical angle attack subsequent loss lateral bank control soft field takeoff.
118,pilot_issue,"The left seated flight instructor’s improper manipulation landing gear position selection lever position still landing roll, ultimately resulted landing gear collapse subsequent landing."
119,pilot_issue,"The pilot's failure maintain proper glide path, resulted landing short runway, airplane’s landing gear contacting runway lip, substantial damage airplane’s right wing."
120,pilot_issue,"The student pilot's failure improper landing flare, resulted hard landing."
121,pilot_issue,"The pilot's inability maintain climb attempted takeoff high density altitude conditions, resulted forced landing road subsequent landing gear collapse."
122,flight_issue,"The National Transportation Safety Board determines probable cause contact Atlantic Huron west center pier Soo Locks following manufacturer’s requirement use thread-locking fluid installation feedback ring locking pin set screw vessel’s controllable pitch propeller system, led failure controllable pitch propeller’s oil distribution box."
123,pilot_issue,The pilot's failure initiate climb timely manner resulted contact wires.
124,pilot_issue,The pilot's failure maintain directional control landing.
125,pilot_issue,"The pilot's decision land unimproved airstrip limited go-around capabilities, improper landing flare aborted landing, subsequent failure attain sufficient altitude clear vegetation attempted go-around."
126,pilot_issue,"The pilot's improper landing flare, resulted bounced, hard landing subsequent runway overrun."
127,flight_issue,The loss engine power due stuck intake valve.
128,pilot_issue,"The loss directional control landing due fracture steering horn bolts, rendered nosewheel steering ineffective resulted airplane towed left turn limits undetermined time accident."
129,pilot_issue,"The flight instructor's delayed remedial action simulated engine failure takeoff, resulted loss directional control."
130,pilot_issue,"The pilot's loss control airplane water landing striking boat wake, resulted substantial damage fuselage."
131,pilot_issue,"The pilot's failure maintain airplane control landing crosswind excessive braking action, resulted airplane nosing over."
132,pilot_issue,"The student pilot’s failure ensure sufficient fuel onboard, resulted total loss engine power due fuel exhaustion, resulted impact terrain."
133,pilot_issue,"The pilot's distraction taxiing, resulted taxiway excursion."
134,pilot_issue,The pilot's improper decision depart unsuitable off-airport surface resulted departure area excursion impact trees.
135,pilot_issue,"The student pilot's improper landing flare failure recover ensuing bounced landing, resulted runway excursion."
136,pilot_issue,The pilot's decision land shortened field incorrect brake application. Contributing flight instructor's lack oversight.
137,pilot_issue,The pilot's failure maintain directional control takeoff resulted collision runway marker.
138,pilot_issue,"The pilot’s improper landing flare, resulted hard, bounced landing, substantial damage airplane’s fuselage."
139,pilot_issue,"The pilot’s loss directional control landing gusting crosswind conditions, resulted runway excursion collision ditch."
140,pilot_issue,"The pilot's loss airplane control approach, resulted aerodynamic stall impact vegetation terrain."
141,pilot_issue,"The pilot's failure maintain directional control landing rollout, resulted ground loop."
142,flight_issue,The reported malfunction aileron flight control system takeoff reasons could determined.
143,pilot_issue,"The pilot's failure ensure amphibious airplane’s wheels retracted attempting water landing, resulting nose touch down. Contributing accident lack checklist available pilot."
144,pilot_issue,"The pilot's failure properly configure airplane takeoff, resulted exceedance airplane's critical angle attack, aerodynamic stall, subsequent impact terrain."
145,pilot_issue,"The pilot's failure maintain directional control airplane aborted landing, resulted ground loop, runway excursion, subsequent nose over."
146,pilot_issue,The pilot's failure perform go around following bounced landing resulted aerodynamic stall.
147,pilot_issue,"The pilot's hard landing airplane's nosewheel, jammed steering, resulted runway excursion impact runway lights."
148,pilot_issue,The pilot's failure maintain directional control landing roll. The pilot fatigued likely contributed failure maintain directional control landing roll.
149,pilot_issue,The pilot's failure maintain clearance fence post initial climb.
150,pilot_issue,"The pilot's improper approach airspeed landing flare, resulted bounced landing, subsequent nose over."
151,pilot_issue,The uncertificated pilot's failure attain/maintain proper angle-of-attack initial climb resulted aerodynamic stall subsequent impact terrain.
152,pilot_issue,"The student pilot's improper landing flare, failure recover ensuing bounced landing, resulted subsequent nose landing gear collapse."
153,pilot_issue,"The pilot’s failure maintain adequate airspeed final approach turbulent conditions, resulted aerodynamic stall subsequent hard landing."
154,pilot_issue,"The pilot's failure maintain directional control takeoff, resulted runway excursion, contact airport perimeter fence, subsequent nose over."
155,pilot_issue,The pilot’s failure maintain directional control landing roll crosswind conditions.
156,pilot_issue,"The pilot's inadequate assessment landing area, resulted airplane's encounter tall weeds landing subsequent nose-over."
157,pilot_issue,"The pilot's inadequate preflight inflight fuel planning, resulted fuel exhaustion."
158,pilot_issue,"The probable cause collapse container stacks onboard barge Ho’Omaka Hou company’s absence initial barge load plan inadequate procedures monitoring stack weights, led undetected reverse stratification container stacks subjected stacks’ securing arrangements increased forces transit sea."
159,pilot_issue,The pilot's failure maintain adequate clearance fence hovering.
160,flight_issue,The loss engine power reasons could determined based available information.
161,pilot_issue,"The pilot’s failure maintain directional control landing, resulted airplane exiting runway striking ditch."
162,pilot_issue,"The student pilot's decision continue visual flight instrument meteorological conditions, resulted collision trees mountainous terrain."
163,pilot_issue,The pilot's improper decision conduct off-field precautionary landing.
164,pilot_issue,"The student pilot's improper landing flare improper recovery bounced landing gusty wind conditions, resulted hard landing."
165,pilot_issue,"The pilot's improper approach, resulted long landing runway overrun."
166,pilot_issue,The pilot's failure maintain airplane control landing gusting wind conditions.
167,pilot_issue,"The pilot's improper landing flare resulted hard, bounced landing, subsequent runway excursion. Contributing accident airplane’s aft center gravity time accident."
168,pilot_issue,"The pilot's inadequate planning, failure secure airplane prior hand-starting engine."
169,environment_issue,"The National Transportation Safety Board determines probable cause flooding sinking fishing vessel Rebecca Mary undetected flooding lazarette, likely non-watertight raised hatch."
170,pilot_issue,The pilot's failure extend airplane’s retractable landing gear landing.
171,pilot_issue,"The pilot's failure maintain adequate clearance rice vegetation, resulted helicopter's impact terrain."
172,pilot_issue,"The pilot’s improper landing flare, resulted hard, bounced landing nose landing gear collapse gusty landing."
173,pilot_issue,"The pilot's inadequate preflight inspection powered parachute, resulted takeoff twisted riser lines impaired aircraft control."
174,pilot_issue,"The pilot’s failure maintain directional control landing crosswind, resulted runway excursion nose landing gear collapse."
175,pilot_issue,"The pilot's failure maintain clearance fence post final approach resulted damage left main landing gear, subsequent collapse landing."
176,pilot_issue,"The pilot's failure maintain control airplane landing approach, resulted airplane exceeding critical angle attack, aerodynamic stall, hard landing, landing gear collapse."
177,pilot_issue,"The pilot's failure maintain airspeed landing quartering tailwind, resulted loss control hard landing."
178,pilot_issue,"The pilot's failure remove seat belt used flight control lock aft cockpit control stick takeoff, resulted loss control takeoff collision terrain."
179,pilot_issue,"A loss directional control takeoff, resulted runway excursion collision trees."
180,pilot_issue,"The pilot's improper flare, resulted hard, bounced landing."
181,pilot_issue,"The student pilot's improper landing flare, resulted hard, bounced landing."
182,pilot_issue,"The pilot's failure maintain clearance power lines maneuvering aerial application flight, resulted wire strike."
183,pilot_issue,"The pilot's failure maintain proper airspeed low altitude aerial application maneuver exceedance airplane’s critical angle attack, resulted aerodymanic stall low altiutde recover."
184,flight_issue,"The mechanic’s failure clean oil suction screen recent maintenance, resulted oil starvation subsequent total loss engine power."
185,pilot_issue,"The flight instructor's delayed remedial action, resulted hard landing loss directional control landing crosswind."
186,pilot_issue,"The pilot's failure maintain directional control landing, resulted runway excursion collision fence.The pilot's inadequate flare resulted bounced landing, failure maintain directional control resulted runway excursion collision fence."
187,pilot_issue,The pilot’s decision attempt takeoff tailwind high density altitude conditions.
188,pilot_issue,"The pilot's improper approach descent rate, resulted hard landing."
189,pilot_issue,The pilot's failure maintain proper glide path final approach resulted collision airport equipment short runway.
190,pilot_issue,A loss directional control result fractured landing gear attach bracket.
191,pilot_issue,The pilot's failure maintain directional control landing.
192,pilot_issue,"Maintenance personnel’s improper installation improperly sized clamp fuel supply line, allowed air enter supply line, subsequent loss engine power, forced landing."
