,Category,ProbableCause
193,pilot_issue,"The pilot's failure maintain control airplane crosswind landing, resulted hard landing runway excursion."
194,pilot_issue,The pilot's failure maintain directional control landing subsequent go-around gusting crosswind conditions.
195,pilot_issue,The pilot's failure maintain adequate clearance parked airplane taxiing. Contributing accident parked airplane's position double-yellow taxiway edge lines taxiway object-free movement area.
196,pilot_issue,"The pilot's incorrect flight control input landing flare, resulted impact ground."
197,pilot_issue,"The pilot’s improper decision load airplane beyond allowable gross weight limits, resulted impact tree collision terrain."
198,pilot_issue,A loss engine power undetermined reasons.
199,pilot_issue,"The pilot's failure maintain control airplane landing roll, resulted landing gear collapse."
200,pilot_issue,The pilot’s failure maintain control float-equipped airplane float became caught trailer used takeoff.
201,pilot_issue,The pilot's decision divert private airport subsequent failure maintain directional control landing turf runway contained tall grass.
202,pilot_issue,The pilot's failure maintain directional control landing.
203,flight_issue,"The National Transportation Safety Board determines probable cause fire aboard vehicle carrier Höegh Xiamen Grimaldi’s SSA Atlantic’s ineffective oversight longshoremen, identify Grimaldi’s vehicle battery securement procedures followed, resulting electrical fault improperly disconnected battery used vehicle cargo deck 8. Contributing delay detection fire crew immediately reactivating vessel’s fire detection system completion loading. Contributing extent fire master’s decision delay release carbon dioxide fixed fire extinguishing system."
204,pilot_issue,The pilot's failure maintain clearance power line maneuvering aerial application flight.
205,pilot_issue,"The pilot's failure utilze emergency landing gear extension procedure short-circuit within normal landing gear system, resulted landing gear collapse landing."
206,pilot_issue,"The pilot's failure maintain directional control airplane aborted landing, resulted ground loop, runway excursion, subsequent nose over."
207,pilot_issue,"The pilot’s failure remove object airplane’s exterior, impacted propeller blades applied full power, causing fracture damage airplane."
208,pilot_issue,"The pilot's improper fuel planning, resulted total loss engine power due fuel exhaustion impact terrain."
209,pilot_issue,The pilot's failure maintain airplane control landing gusting wind condition resulted collision terrain.
210,pilot_issue,The student pilot's failure maintain directional control airplane soft-field takeoff flight instructor's delayed remedial action.
211,pilot_issue,The pilot's failure maintain airplane control takeoff soft airstrip resulted collision objects.
212,pilot_issue,The pilot failed maintain adequate airspeed final approach impacted terrain.
213,pilot_issue,"The student pilot's improper landing flare flight instructor's inadequate supervision, resulted hard landing."
214,pilot_issue,The pilot's failure maintain airplane control landing turbulent conditions.
215,pilot_issue,"The pilot’s failure maintain proper airspeed exceedance airplane’s critical angle attack, resulted aerodynamic stall.."
216,pilot_issue,"The pilot's failure maintain directional control landing gusting wind conditions, resulted ground loop."
217,pilot_issue,The loss engine power due fuel exhaustion pilot’s improper fuel planning flight.
218,pilot_issue,The pilot's failure extend landing gear precautionary landing electrical failure.
219,pilot_issue,The pilot’s failure maintain directional control landing variable wind conditions.
220,pilot_issue,"The pilot's excessive brake application landing roll avoid animal runway, resulted ground loop."
221,pilot_issue,"The pilot's failure maintain terrain clearance departure, resulted collision terrain.."
222,pilot_issue,"The pilots failure switch fuel pump 'OFF' position landing, resulting loss engine power subsequent collision fence landing. Contributing accident modified landing checklist omitted fuel pump switch position."
223,pilot_issue,The pilot’s failure maintain control airplane takeoff.
224,pilot_issue,The pilot's failure maintain airplane directional control gusty crosswind landing.
225,pilot_issue,The pilot's failure maintain helicopter control gusting wind resulted loss altitude subsequent collision fence.
226,pilot_issue,"The pilot’s failure maintain proper descent rate landing gusting wind conditions, resulted hard landing."
227,pilot_issue,The pilot's delayed decision abort takeoff airplane attaining sufficient airspeed takeoff subsequently departed end runway collided terrain. Contributing accident pilot's inadequate preflight preparation planning decision takeoff tailwind.
228,pilot_issue,"The pilot's failure maintain directional control landing roll soft turf runway, resulted nose-over."
229,pilot_issue,Aircraft control maintained initial climb gusting wind resulted collision power lines terrain.
230,pilot_issue,"The pilot's failure maintain directional control takeoff gusting wind conditions, resulted runway excursion collision trees."
231,pilot_issue,"The pilot's loss directional control landing, resulted runway excursion."
232,pilot_issue,The pilot's loss control landing tailwheel airplane.
233,pilot_issue,The pilot's failure maintain directional control landing.
234,pilot_issue,"The pilot's loss directional control aborted takeoff tailwind, resulted noseover."
235,pilot_issue,"The pilot's failure maintain proper airspeed final approach landing, subsequent failure attain sufficient altitude clear trees attempted go-around."
236,pilot_issue,The pilot's loss control aborted landing.
237,pilot_issue,The pilot's failure maintain directional control takeoff.
238,pilot_issue,The pilot's failure maintain directional control landing. Contributing pilot getting shoe caught rudder pedal.
239,pilot_issue,The pilot's failure maintain clearance power lines go-around.
240,pilot_issue,The pilot's excessive brake input attempted maintain directional control landing roll.
241,flight_issue,A right main landing gear break malfunction landing. Contributing accident worn right main landing gear caliper pin pressure plate hole.
242,pilot_issue,The pilot's failure maintain adequate clearance ground obstacle landing.
243,pilot_issue,The pilot's loss directional control takeoff crosswind.
244,pilot_issue,"The pilot's failure maintain rotor rpm precautionary autorotation, resulted hard landing. Contributing accident airframe vibration reasons could determined examination helicopter revealed anomalies."
245,flight_issue,The airplane builder's improper installation lower right wing resulted uncommanded left roll subsequent loss control.
246,pilot_issue,The pilot's failure maintain control helicopter lift off. Contributing accident pilot's lack recent experience flying helicopter.
247,pilot_issue,An inadequate flare resulted bounced landing pilot's subsequent delayed decision go-around allow sufficient clearance trees airplane affected gusting wind.
248,pilot_issue,"The pilot's failure maintain directional control landing roll, resulted ground-loop."
249,pilot_issue,"The pilot's failure attain proper touchdown point landing tail wind, resulted runway excursion."
250,pilot_issue,"The pilot's failure maintain directional control takeoff gusting wind conditions, resulted collision trees impacted ground."
251,pilot_issue,"The failure pilot adequately maintain safe distance airplane's propeller, resulted serious injury propeller struck hand."
252,pilot_issue,"The pilot's failure retract amphibious airplane's landing gear wheels prior water landing, resulted nose over."
253,pilot_issue,The pilot's inadequate preflight fuel quantity resulted loss engine power due fuel starvation cruise flight.
254,pilot_issue,"The pilot's failure maintain directional control landing roll, resulted ground loop."
255,pilot_issue,"The pilot's decision continue flight instrument meteorological conditions airplane equipped instrument flight, forced perform precautionary landing muddy field resulting airplane nosing over."
256,pilot_issue,The pilot's failure maintain adequate landing flare resulted porpoise impact terrain.
257,pilot_issue,"The pilot's failure maintain obstacle clearance maneuvering low altitude night, resulted helicopter striking tree."
258,pilot_issue,The pilot's failure maintain directional control landing gusting crosswind conditions.
259,pilot_issue,"A loss thermal lift motor glider flight, resulted off-airport landing. Contributing accident pilot's delayed attempted engine start."
260,pilot_issue,The loss lift final approach resulted hard off-airport landing.
261,pilot_issue,A dual total loss engine power result fuel exhaustion.
262,pilot_issue,"The student pilot/builder’s addition winglets stabilator, resulted flutter overstress failure stabilator control horn."
263,environment_issue,"The National Transportation Safety Board determines probable cause collision Nomadic Milde Atlantic Venus bridge team Nomadic Milde effectively monitoring vessel’s position, therefore detecting vessel dragging anchor moved original position high water conditions proximity vessels."
264,pilot_issue,The pilot's loss directional control landing tailwheel airplane gusty wind conditions.
265,pilot_issue,"The front seat pilot's failure maintain directional control landing roll, rear seat pilot's delayed remedial control inputs subsequently resulted ground loop. Contributing accident lack communication pilot's establish clearly defined pilot-in-command roles prior accident flight."
266,flight_issue,The loss engine power due fuel starvation.
267,pilot_issue,"The pilot's failure retract speedbrakes delayed go-around attempt, resulted runway excursion."
268,pilot_issue,The pilot's diverted attention taxing resulted failure maintain clearance skip loader taxi.
269,pilot_issue,"The pilot’s decision attempt "" water ski"" atop remote river wheel-equipped airplane, resulting loss control nose over."
270,pilot_issue,"The pilot's failure maintain directional control takeoff roll, resulted runway excursion ground-loop."
271,pilot_issue,"The uncertificated pilot's failure maintain aircraft control takeoff, resulted impact terrain."
272,pilot_issue,"The pilot's failure maintain control airplane landing roll, resulted nose over."
273,pilot_issue,"Seizure hydraulic pump pulley bearing due improper installation manufacturer, leading failure hydraulic pump belt resultant partial loss hydraulic assistance pedals."
274,environment_issue,The collapse left main landing gear reasons could determined based available information.
275,pilot_issue,A primary control (aileron) system anomaly progressively worsened test flight resulted loss control. The reason anomaly determined due impact damage.
276,pilot_issue,"The pilot's failure extend landing gear runway landing, resulted gear-up landing."
277,pilot_issue,The pilot's inadvertent extension landing gear subsequent water landing wheels extended.
278,pilot_issue,"The pilot's inadequate preflight inspection fuel planning, resulted loss engine power due fuel exhaustion."
279,pilot_issue,The pilot's loss control go around.
280,pilot_issue,A gradual loss engine power takeoff due pressure regulator keeping continuous fuel pressure led precautionary airport landing collision terrain.
281,pilot_issue,"The flight instructor's improper landing flare, resulted bounced landing, subsequent loss directional control."
282,pilot_issue,"The loss engine power due fuel starvation result unporting fuel tank supply pickup helicopter maneuvered move conductor wire. Contributing accident helicopter’s inappropriate configuration type operation conducted, impeded pilot’s ability release long line perform successful emergency landing."
283,pilot_issue,"The pilot's improper decision land unsuitable terrain, resulted nose-over."
284,pilot_issue,"The pilot's failure maintain directional control landing roll gusting wind conditions, resulted roll-over."
285,pilot_issue,"The pilot's failure maintain directional control high-speed taxi quartering tailwind, resulted runway excursion impact fence terrain."
286,pilot_issue,"The student pilot’s failure maintain stabilized approach flight instructor's delayed remedial action initiate go-around, resulted runway overrun impact runway lights fences."
287,pilot_issue,"The pilot's failure maintain airplane control aborted landing, resulted collision trees."
288,pilot_issue,"The flight instructor's failure set proper rotor rpm practice autorotation, led failure maintain proper descent rate resulted hard, bounced landing."
289,environment_issue,"The airplane's encounter sunken area takeoff turf runway, resulted airplane becoming prematurely airborne impacting tree terrain."
290,pilot_issue,The pilot's failure maintain airplane control landing gusting quartering tailwind.
291,pilot_issue,"The pilot's misjudgment ground spray rig’s position incorrect belief runway incursion might occur, resulted pilot attempting aborting go-around, resulted runway excursion collision fence."
292,pilot_issue,"The noncertificated pilot’s decision take large helicopter’s rotor wash, resulted inability gain altitude takeoff."
293,pilot_issue,"The pilot's improper decision land unsuitable terrain, resulted nose-over."
294,pilot_issue,"The pilot's failure attain sufficient altitude go-around, resulted impact hilly terrain."
295,pilot_issue,"The pilot's failure maintain control airplane takeoff gusting wind conditions, resulted uncontrolled turn descent terrain."
296,pilot_issue,"The pilot's failure maintain stabilized approach improper landing flare, resulted porpoised landing."
297,pilot_issue,The pilot's failure extend landing gear landing due distraction condition runway failure use Before Landing checklist.
298,pilot_issue,"The pilot's failure maintain directional control airplane landing roll, resulted runway excursion nose-over."
299,pilot_issue,"The collapse right main landing gear bounced, crosswind landing."
300,pilot_issue,"The flight instructor's delayed remedial action power-off approach go-around gusting wind conditions, resulted hard landing, loss directional control, runway excursion onto field."
301,pilot_issue,"The pilot's loss directional control subsequent improper brake application landing roll gusting wind conditions, resulted nose-over."
302,pilot_issue,A loss engine power takeoff undetermined reasons.
303,pilot_issue,"The pilot's loss directional control landing roll, resulted ground loop."
304,pilot_issue,"The pilot's inadequate preflight inspection fuel level, resulted total loss engine power due fuel exhaustion."
305,pilot_issue,"The motor glider's encounter atmospheric lift conditions sufficient maintain flight, necessitated forced landing resulted impact vegetation. Contributing accident pilot's delayed decision restart motor glider's engine."
306,pilot_issue,The pilot's overapplication brakes landing subsequent loss directional control nose-over.
307,pilot_issue,"A hard landing occurred unknown time date, resulted substantial damage identified prior subsequent flight."
308,pilot_issue,"The pilot's selection unsuitable terrain landing, necessitated go-around, subsequent failure maintain clearance rising mountainous terrain."
309,pilot_issue,The pilot's failure maintain clearance tree maneuvering low altitude.
310,pilot_issue,"The pilot's inadequate preflight planning attempted takeoff obstacles direction departure, failure maintain control airplane rejected takeoff."
311,pilot_issue,"The noncertificated pilot's diverted attention looking fire low-altitude flying, resulted collision power lines."
312,pilot_issue,"The pilot's loss directional control landing gusting crosswind conditions, resulted runway excursion impact snowbank."
313,pilot_issue,"The pilot’s failure apply full engine power initiation go-around gusting wind conditions exceedance airplane’s critical angle attack, resulted aerodynamic stall low altitude, flight instructor's delayed remedial action."
314,pilot_issue,The pilot receiving instruction’s failure maintain airplane control simulated engine failure landing subsequent attempted go-around gusting crosswind conditions flight instructor's delayed remedial action.
315,pilot_issue,"The student pilot’s improper landing flare, resulted bounced landing, subsequent loss directional control, airplane going embankment."
316,pilot_issue,The pilot's failure see avoid parked vehicle near taxiway edge.
317,pilot_issue,"The flight instructor's delayed remedial action decision go-around bounced landing, resulted inadvertent stall hard landing."
318,pilot_issue,"The pilot's inadequate compensation gusting crosswind conditions, resulted loss directional control, runway excursion, impact snowbank."
319,pilot_issue,"The pilot's failure maintain directional control landing gusting crosswind conditions, resulted runway excursion impact vegetation."
320,pilot_issue,"The pilot's loss directional control takeoff icy ski strip gusting wind conditions, resulted left wing impacting tree."
321,pilot_issue,"The pilot's failure extend landing gear due distraction delayed go-around, allowed airplane get low contact runway landing gear retracted."
322,pilot_issue,"The pilot's inadequate preflight fuel planning inflight fuel management, resulted fuel exhaustion total loss engine power."
323,pilot_issue,"The partial loss engine power due water contaminants fuel, due pilot’s inadequate preflight inspection, pilot’s decision conduct steep turn low altitude return runway rather land straight ahead, resulted aerodynamic stall."
324,pilot_issue,"The owner/pilot's inability maintain control airplane due lack training experience, resulting collision tree."
325,pilot_issue,"The pilot's unintentional selection wrong landing surface, covered 2 ft snow resulted nose-over."
326,pilot_issue,"The pilot’s fuel mismanagement flight, resulting total loss engine power due fuel starvation."
327,pilot_issue,"The in-flight failure lower left side engine cowling due mechanic’s improper installation fasteners, resulted cowling impacting four main rotor blades."
328,pilot_issue,"The pilot's failure maintain airplane control landing gusting crosswind conditions, resulted wing striking ground."
329,pilot_issue,excessive pitch attitude touchdown.
330,pilot_issue,"The pilot's selection unsuitable terrain landing, resulted collision ditch left main landing gear collapsing."
331,pilot_issue,"The pilot's incorrect right rudder application touch-and go-landing, resulted loss directional control, runway excursion, collision runway sign."
332,pilot_issue,"The failure nosewheel steerage linkage takeoff, resulted loss directional control impact obstacle attempted aborted landing."
333,pilot_issue,"The student pilot's failure avoid wake turbulence landing behind heavy jet airplane, resulted loss roll control subsequent hard landing."
334,pilot_issue,The National Transportation Safety Board determines probable cause contact Cooperative Spirit tow pier Hale Boggs Memorial Bridge pilot effectively compensating strong current navigating turn approaching bridge high-water conditions
335,pilot_issue,"The student pilot's loss directional control landing, resulted runway excursion, collision pole, subsequent ground loop."
336,pilot_issue,"The pilot's failure maintain directional control attempted go-around avoid birds, resulted runway excursion subsequent nose-over."
337,pilot_issue,"The pilot's improper starting procedure, allowed airplane move forward wheel chocks impact hangar subsequently hand propped engine."
338,pilot_issue,"The pilot's failure maintain airplane control maneuvering low altitude, resulted collision terrain."
339,pilot_issue,"The pilot's improper decision initiate takeoff roll snow-covered taxiway, resulted loss directional control, runway excursion, impact snow berm."
340,pilot_issue,"The pilot's improper landing flare gusting wind conditions, resulted bounced landing, loss directional control, runway excursion, impact tree."
341,pilot_issue,"The pilot's failure see avoid trees maneuvering low altitude, resulted loss airplane control."
342,pilot_issue,"The pilot's failure reconnoiter approach area preparation off-airport landing sandbar, necessitated evasive maneuver avoid wires resulted unintentional landing river short sandbar subsequent nose-over."
343,pilot_issue,"The pilot's improper decision turn airplane runway onto taxiway excessive speed, resulted loss directional control, runway excursion, collision taxiway sign."
344,pilot_issue,"The trainee pilot's loss directional control landing subsequent unintentional control interference brakes and/or rudder trainer pilot's attempted remedial action, resulted runway excursion collision ditch."
345,pilot_issue,"The pilot's loss directional control takeoff gusting crosswind conditions, resulted runway excursion impact runway approach light."
346,pilot_issue,"The pilots' failure ensure electric fuel pumps takeoff, resulted partial loss power engines initial climb."
347,pilot_issue,"The pilot's improper decision continue instrument approach landing following loss visual reference runway, resulted airplane touching left runway snow flipping over."
348,flight_issue,"The fatigue failure pneumatic line reasons could determined, resulted loss engine power subsequent hard landing."
349,pilot_issue,"The malfunction steerable tailwheel, resulted loss directional control landing roll subsequent impact precision approach path indicator lights system."
350,pilot_issue,"The flight instructor's failure maintain directional control landing gusting crosswind conditions, resulted runway excursion nose-over."
351,pilot_issue,"The pilot's failure maintain proper altitude airspeed approach delayed addition power go around flight instructor’s delayed remedial action, resulted nose-over landing closed snow-covered runway."
352,pilot_issue,"The pilot's failure maintain altitude/clearance approach, resulted airplane impacting area deep snow. A factor associated accident flat light conditions."
353,pilot_issue,"The pilot's failure maintain glider control exceedance glider's critical angle attack maneuvering gusting wind conditions, resulted aerodynamic stall."
354,pilot_issue,"The pilot flying's improper lateral bank control go-around gusting wind conditions, resulted left-wing tip tank striking runway."
355,pilot_issue,"The pilot's failure maintain adequate airspeed approach, resulted rapid descent rate, hard landing, nose-over."
356,pilot_issue,"The pilot struck head propeller flight, resulted serious injury."
357,flight_issue,"The pilot's failure use carburetor heat conditions conducive carburetor icing, resulted partial loss engine power, precautionary landing, impact snow."
358,pilot_issue,"The pilot's lifting airplane high angle attack, resulted aerodynamic stall."
359,pilot_issue,"The pilot's inadvertent activation left brake landing roll, resulted loss directional control, runway excursion, collision ditch."
360,pilot_issue,"The student pilot's improper landing flare subsequent improper recovery bounced landing, resulted nosewheel collapsing."
361,pilot_issue,"The student pilot's improper landing flare failure conduct go-around, resulted bounced landing nosewheel collapsing."
362,pilot_issue,The rear seat pilot student pilot's failure see avoid trees initial climb following aborted landing.
363,pilot_issue,"The pilot's failure maintain proper landing flare, resulted hard, bounced landing, subsequent loss directional control, resulted ground loop."
364,pilot_issue,"The student pilot's failure maintain proper airspeed descent rate conducting low pass snow-covered runway encountering downdraft flight instructor's delayed action, resulted wheels contacting snow airplane nosing over."
365,flight_issue,"The National Transportation Safety Board determines probable cause fire aboard towing vessel City Cleveland catastrophic failure crankcase breach port main engine resulting failure connecting rod assembly. Contributing severity damage vessel lack fixed fire-extinguishing system engine room, well loss electrical power single fire pump."
366,pilot_issue,"The pilot's failure maintain airplane control landing flare gusting crosswind conditions, resulted left wing striking runway."
367,pilot_issue,"The flight crew's failure stop airplane available runway, wet resulted airplane impacting ditch."
368,pilot_issue,"The pilot’s failure maintain clearance power line pole low-level aerial application flight, resulted impact bracket subsequent forced landing."
369,pilot_issue,"The pilot's failure land stop airplane within available runway, resulted runway overrun. Contributing outcome pilot's inadvertent feathering propellers approach landing."
370,pilot_issue,"The pilot's improper landing flare touchdown, resulted bounced landing loss directional control airplane's subsequent impact snowbank ground loop attempted go-around."
371,pilot_issue,"The pilot's failure lock tailwheel landing, resulted loss directional control landing roll, runway excursion onto soft ground, subsequent ground loop."
372,pilot_issue,"The flight instructor’s inadequate communication pilot review intention simulate single-engine failure subsequent exceedance airplane’s critical angle attack pilot respond expected, resulted aerodynamic stall low altitude."
373,pilot_issue,The pilot's failure maintain bank control landing gusting wind conditions.
374,pilot_issue,"The pilot's failure maintain airplane control approach, resulted airplane ballooning veering left upon landing right wing impacting runway."
